review_id,rating,comment,is_negative
95898445,5,"I visited my old neighborhood for a few days. During my stay, everything was lightning quick. Amazing service by the team here.",0
95898446,5,We stayed here for an entire week while attending a family reunion right down the road. This place was amazing with great food and fun amentities to enjoy while visiting family.,0
95898447,1,"My husband and I had to stay at this hotel for one night. I have never been to such a terrible place. I  have not seen such a shabby room. The room was disgusting (although the sheets seemed clean). The furniture had spots, tear, and looked like it was picked up off the curb. ",1
95898448,4,Stayed for three nights. The only thing lacking was the quality of the spa package we purchased,0
95898449,4,Very satisfactory and comfortable.very convenient and met all our requirements.,0
95898450,4,The hotel itself feels nice but outdated. Still and overall fun stay.,0
95898451,2,"Very outdated, terrible water pressure, not enough towels in the room for a couple and the AC was very old and loud. ",1
95898452,1,"Absolutely horrible! I was looking for an affordable place to stay for a weekend trip to Watkins Glen and decided to book this place. Worst decision I ever made! I arrived about 10:00pm, had to ring a doorbell to be checked in by a man who came out to the desk in his UNDERWEAR. The room had a musty smell... More",1
95898453,4,Clean and well maintained.,0
95898454,3,"The front desk staff was very helpful. However, it felt like this resort was somewhat lacking. Nothing too mind-blowing.",0
95898455,5,I have stayed at the Lofts on Pearl for the past couple of years following a Bills game. The rooms lack nothing. They are perfect as well as the staff. They are so welcoming and take care of our needs while we are visiting . Beautiful place !!!!!!,0
95898456,4,"Fantastic family accommodations!!! The good - Staff was great! Welcoming, friendly and very accomodating. Beds were very comfortable. Except for the very springy pull out couch. Bathroom was very clean. Location was superb!! ",0
95898457,4,Fun beach resort overall! The food in the hotel restaurants was amazing too.,0
95898458,5,Cannot say enough good about this place! The amenities and views were just too good to be true!,0
95898459,5,"The staff was very friendly, especially Housekeeping. The breakfast offered a lot of variety. The hotel amenities were great. Great value resort!",0
95898460,5,"Extremely pleased with our hotel stay. We are a family of 5 and recently spent 2 nights at this hotel. I was pleasantly surprised at the size of our suite and the friendliness of the staff. There is a popcorn machine in the lobby, which my kids loved. We also caught the staff setting out warm chocolate chip cookies in the evenings-YUM! Such a nice homey touch! The free breakfast was outstanding. We traditionally don't expect much from a hotel spread, but this one was the exception. Lots of selections, and the hot options changed from one morning to the next. Breakfast attendant was friendly and helpful, and kept everything well stocked as the crowd ebbed and flowed. The only negatives were an extremely loud family in the room above us that kept us awake until almost midnight. The hotel staff did they best to help and even offered to move us, but we opted not to take them up on the offer. Nothing else the staff could have done to help that situation. I was also disappointed that the hot tub wasn't working, but the kids had a wonderful time in the pool regardless.",0
95898461,5,Great Experience considering the horrible weather we were having. The staff was exceptionally nice and friendly. Breakfast was very good and the location in all was serene.,0
95898462,4,"This Hampton was consistent with my other experiences at their properties, which is why I like staying there. The room was comfortable and well insulated from ambient noise, the staff was friendly and attentive, and the breakfast offered a decent variety of hot/cold items. The one exception was my disappointment with the condition of the bathroom, which had paint peeling on the ceiling, and a tub that was stained from age. It could use a refreshing, and detracted from an otherwise satisfying Hampton experience.",0
95898463,2,The pictures of the hotel looked better on line. The staff was ok not great. No one looked like they wanted to be there.,1
95898464,3,Everything was good. I only spent a short night. I had an early flight the next morning.,0
95898465,1,"Following a fourteen hour drive, we arrived, very tired, to check in at 3 AM. The room had stained carpets, lights that didnt work and things just didnt seem particularly clean. However, the bed was nicely made and we were very tired. I pulled back the bed spread to find rumpled sheets covered in blood. ",1
95898466,3,"Nothing special to recommend this resort, but it's adequate and serviceable.",0
95898467,2,"Everyone was very friendly, however room wasn't super clean and our shower temperature was all over the place while taking a shower. Needs updating and small repairs I think.",1
95898468,2, The elevators need repairing. They are so noisey. You guys have... More,1
95898469,4,This is the second time staying here. The rugs in the hall are getting noticeably worn. It is a clean hotel and the staff are great. Everyone had a smile and said hello. ,0
95898470,3,Definitely chic but nothing special. It's a good vacation stay if you like the beach.,0
95898471,5, Great staff.. Next time we come out here we will stay here.. The bathrooms were very clean and the rooms were not too hot or too cold. Like I said will stay there from now on..,0
95898472,4, The staff was very accommodating. Thank you all for everything!,0
95898473,3,It was okay. I feel that this resort is lacking in some areas.,0
95898474,5,"Love this place! Great service, rooms and amenities. The restaurants provide top gourmet food and are always so accommodating!",0
95898475,5,"Very clean and pleasant hotel. The noise level almost non existing, always a plus for me! The staff was very professional and catered to my needs without question. The banquet hall was very clean, a great size, well put together, and affordable. I will definitely be doing business with this location again. Thank you for providing me with a home... More",0
95898476,4,Such a good stay. The pool and beach side food service was a nice touch.,0
95898477,5,Lovely beach resort with a beautiful view of the sunrise and sunset,0
95898478,5,"Everyone there is very friendly, accommodating and helpful. Never had a problem here and continental breakfast offers a huge variety.",0
95898479,4,"We stayed here and really enjoyed our stay. Nice rooms, clean although the carpet in the room we stayed in needs to be replaced. This hotel did pay attention to our special requests, which rarely happens and sometimes those little things make a BIG difference. We didn't try the breakfast but we will next time we stay here.",0
95898480,5," The hotel staff were polite and courteous. The rooms were quiet and comfortable. During both of our stays, we were the only ones using the pool and that was a bonus. Definitely recommend this resort!",0
95898481,4,"Was in town for a convention.  Room was very nice Super water pressure in the shower, but, very slow drainage. ",0
95898482,5,The bathroom was very clean. The beds were comfortable. I loved the views.,0
95898483,3,The junior suite was spacious but it wasn't anything too special. The resort itself is nice and has a lot of potential.,0
95898484,4,They have a nice breakfast buffet along with other food options for lunch and dinner with their different In hotel resraurants.,0
95898485,5,I had a great experience at this hotel. Everybody is friendly and the rooms are very clean. I utilized the fitness center to help me maintain my work out regiment. Kendra was my favorite employee. I would definitely stay here again because of the ease of access in location and friendly customer service.,0
95898486,5,Came for a weekend with a child. The front desk staff was always friendly and helpful. Pool area was clean and the rooms were very nice. Would definitely recommend. Had no complaints at all. They are located a little off the beaten path but it was nice and quiet.,0
95898487,5,"This was an excellent hotel. Very clean and updated. Nice comfortable beds and covers. The complimentary breakfast had a huge selection and something for everyone. The only draw back was it was on the expensive side, but I guess you get what you pay for because I can't think of anything to complain about. Lol.",0
95898488,5, This hotel will probably be the only one we stay at for our summer vacations. So amazing! Thank you!,0
95898489,4,This was the best.  The decor is upscale contemporay and the front desk staff were cheery and happy to see you. ,0
95898490,5,. The beds were super comfortable after our trip.The amenities were great for our family.,0
95898491,5,We checked in late Friday evening and were warmly and expertly greeted.,0
95898492,4,Having a small fridge was nice. The front desk folks were very friendly. We would stay here again.,0
95898493,2,"If you're a fan of thin pillows and rock hard beds you are home. On a positive note, the room was clean and the towels were soft. Genuinely overpriced",1
95898494,5,Stayed here for 7 nights hotel was amazing and should be rated a 5 star plus everything was perfect,0
95898495,5,The amenities are very nice with very comfortable bedding and living area.,0
95898496,5,Our room  felt like we were staying in a hi-end condo with breathtaking views of the beach. So beautiful!,0
95898497,3,"The issues started the first night. I complained the first night to the front desk and actually a maintenance guy because our toilet kept running. Other than that, we made the best of it. Just make sure to fix your issues before your guests stay here.",0
95898498,5,"Unfortunately, I had pulled my hamstring prior to my arrival and was in extreme pain after walking through 2 airports and pulling my luggage. The hotel staff took me to my room in a wheelchair and brought me ice and other items to assist with my pain. On top of that, they gave me a Get Well card signed by all the staff. ",0
95898499,5,"This is a really lovely resort. And because it has most of anything you need at pretty high quality, it is not cheap. We stayed for two days and enjoyed both beertasting and whiskey/whiskytasting at the restaurants!",0
95898500,4,Stayed here for one night and really enjoyed it. The place is very modern and is being upgraded. The staff couldn't have been any nicer. Great bar with pretty good bar food.The bar tenders were super. Place was very clean. The only problem is you're a little removed from the action but a short Uber/Lyft ride and you're there.Worth going back to next time I'm in San DIegoThank you for your review. We are so happy to hear you enjoyed your stay with us here in San Diego.,0
95898501,5,My husband has business here and I tagged along. What a fantastic hotel. The service is impeccable. ,0
95898502,4,"We got a couple of connecting suites, very confortable and with all the necesary ammenities. Stayed there for a week. Contemporary and stylish.",0
95898503,4,Beautiful modern king city view suite. A few quirks like 12th floor check in and directions needed to leave. Staff was very nice and helpful 40 per night off site valet parking but it was pretty quick. Walking distance to Gaslight district. Close to waterfront and airport. Overall great value Thank you for your review. We are pleased to hear you enjoyed your stay with us here in San Diego.,0
95898504,3,"Good resort overall. Nothing that screams the best, but is surely quality.",0
95898505,3,It's fair. A resort that does the job and has good amentities. Very beautiful beach though!,0
95898506,2,"Maintenance needs to do a better job. When the bathroom is leaking, please fix it! No one sleeps in a flooded room!",1
95898507,4,The service and people are the perfect. ,0
95898508,5,The hotel is well furnished. My only criticism was the toiletries in the shower and the shower handle are poorly placed. I hit my elbow a few times and the toiletries caddy makes it hard to wash your hair under the shower.,0
95898509,5,I used this hotel for an event we were having and was amazing! The location was perfect since it was literally right on the beach. Everyone enjoyed their stay and I enjoyed how easy it was to coordinate accommodations for 30 people. ,0
95898510,5,Lovely resort! Thank you so much for everything!,0
95898511,4,Overall it was nice. Our room though was a bit tinier than expected for what I paid.,0
95898512,1,"Place is so dirty and not well kept, but what got me the most is how unprofessional the night auditor was!!! He had such a bad attitude I even said to cancel my reservation cause I didn't care for his attitude. ",1
95898513,1,"This has to be by far the nastiest and unkempt hotel I have ever seen! There were stains on everything...The shower curtain, chairs, wall and bed spread. Some of the staff was very rude.",1
95898514,1,"The clerk was extremely slow and after 15 mins, still could not find our paid reservation on her computer.",1
95898515,1,"For a resort, this was awful. The food was atrocious and I could not stand anything of what this place had to offer.",1
95898516,5,"Smallish room--tastefully appointed with touches I've seen in high-end hotels--was cozy and comfortable. The crowning grace, though, was the excellent and helpful staff. The front desk staff was uniformly friendly, interested in helping us enjoy our stay, and full of useful not-in-the-guidebooks information. We'd return to the hotel without hesitation.",0
95898517,5,"Staff was very friendly and helpful, Amenities were nice and our room was a little on the small size but comfortable.",0
95898518,4,Beautiful resort!,0
95898519,2,"I understand that it is quite likely a great improvement over years past, however the refresh is superficial only. The floors still creak and were bowed and the climate control is minimal. The provided window air conditioner has not been serviced in some time and the air was not cool. ",1
95898520,5,"Great location! Even though secluded, there were many things to do! The food was amazing inside the hotel itself!",0
95898521,3,I can tell that the hotel is making serious strides towards improvement and the staff is seriously the highlight of the entire stay. They are wonderful and made us feel welcome during our entire stay. The cleanliness needs to improve however.,0
95898522,5,"I have stayed at all the big hotels in the Union Square (Westin, Hyatt, Hilton, etc ) and a number of boutique offerings as well. This may be my favorite one. The valueIs by far the best in the area. The staff are all very friendly and helpful and the vibe is casual/chic. Huge thumbs up!",0
95898523,5,A wonderful hotel right on the water. The staff at the hotel go beyond the call of duty to be helpful. The rooms are small but very well equipped. The beds are very comfortable. This hotel is a real gem and I can highly recommend it.,0
95898524,5,The hotel was very clean. The staff are all nice.,0
95898525,5," Upon arrival we were promptly attended to and checked in quickly. Vallet took our vehicle and we headed up to our room. Enjoy the Pictures and the hotel, it is in an incredible location!",0
95898526,3,Fairly standard resort that does the job. It’s just okay to be honest.,0
95898527,4,Lovely resort! It was a really good time!,0
95898528,5,The beach was so beautiful and the food was delicious!,0
95898529,4,The pool is definitely my highlight and is for sure what I would come back to.,0
95898530,5,The food specials they have in the bar and the restaurants are stunning.,0
95898531,5,The views are so stunning. I can't believe how great this place is!,0
95898532,1,"Disgusting spa area. The water is so brackish. I get it, we are at the beach and it may affect the water. But that's even more reason to make sure that everything is taken care of. Please fix it.",1
95898533,4,Great place overall. Transportation to the resort is hit or miss.,0
95898534,5,Wow is all I can say. What an amazing experience.,0
95898535,1,"Our dinner was really bad. My porterhouse was overcooked, my wife's food wasn't seasoned and the cocktails we ordered were overly sweet.",1
95898536,5,This is the best place to be. On a beautiful beach sipping sangria. ,0
95898537,4,This hotel is definitely really good. Only downside is the price.,0
95898538,4,"Really great, but not the best value.",0
95898539,5,Very extravagant. Our suite was impeccable and the ocean view was breathtaking.,0
95898540,5,I can't believe I stayed here! All the staff were so efficient and helpful. Such an amazing time.,0
95898541,4,Staff was great and really work hard. The room was a little untidy.,0
95898542,5,The charcuterie they offered in the bar was amazing. I was there every night.,0
95898543,5,The small bites place in the bar were superb. Amazing overall!,0
95898544,5,Room was perfect for us and the beds were very comfortable. We will certainly come back and do it again in the near future and stay at the same place. Will definitely come for the amenities,0
95898545,5,We had the wet bar suite and it was really spacious and nice for our family.Breakfast was great! Staff was super friendly.,0
95898546,4,"If you are a family traveling with children, you will feel right at home. The proximity to Sea World attracts families of all nationalities...the only time you experience the family confusion is during breakfast. The property itself is new, well staffed and features Hampton's newest ideas as to what they perceive the traveling public desires.Dear frankmJ9377CF,Thank you so much for choosing our property during your trip to Orlando and writing about your recent stay with us! We truly hope you and your family felt at home here. We apologize for any confusion you may have experienced during our breakfast. Our staff will continue to work to improve the efficiency and flow of the breakfast area. We hope to see you all again here soon!Safe travels,Nicholas Houck",0
95898547,4,Pretty good hotel. Check in and check out was super easy. Staff was super friendly. Hotel was very clean and looked great.,0
95898548,5,The staff is very helpful and will assist in giving the guests the best information reegarding the area. I recommend this hotel.,0
95898549,2,Ther were too many hassles during the check in process and rooms not being available multiple times. Delay after delay is the name of the game here.,1
95898550,5,"Stayed at this hotel for business and was delightfully surprised. Along with the beach, it's nice to unwind with a cocktail and a view after a hard day at a convention.",0
95898551,5,This hotel is clean. The staff go out of their way to be kind and made our stay memorable!,0
95898552,5,Great Hotel. Excellent value. Great location. Would definitely stay here again. Includes breakfast with very nice selection. Staff very courteous.,0
95898553,5,the staff is friendly make sure you don't get a room by the elevators the bell will wake you up also make sure you don't eat the plastic apples they leave in a bowl in the meeting room why plastic vs real.,0
95898554,2,"The HVAC did not work properly leading to both of us having a restless night's sleep. The location was great and the room and layout were also ideal. It is a beautifyl hotel however, but man was it hot.",1
95898555,4,Reallly great. Thank you to all of the staff that helped us!,0
95898556,5,Amazing!,0
95898557,4,You guys are so great you helped with literally everything. Just make sure the spa is better!,0
95898558,1,That spa was really bad. Never again. How do you seriously charge all of that money to bring such a lackluster experience to the guests?,1
95898559,5,I love staying here. The hotel still has a concierge lounge and they have always helped us with anything that we needed.,0
95898560,4,"The hotel lobby is beautiful and we enjoyed a few nights using it. There are a few restaurants/bars onsite with lovely options for food. Overall, it was very clean, friendly and a great hotel. ",0
95898561,4,Stayed here for a convention being held in adjacent convention center. VERY convenient to that Convention Center....easy walk. But hotel itself was just ok. Room nothing special.,0
95898562,5,"This hotel was very much like a resort in the city. Indoor and outdoor pools, two racket ball courts, Jacuzzi hot tub, steam room and sauna. The food in the restaurant was really good too. You could spend two or three days here and be totally rejuvenated. I look forward to returning.",0
95898563,5,Really great! I have no complaints and I will we back with my friends and family.,0
95898564,5,"I spent nine days here and must say the people are the most responsive hotel employees I have ever experienced. The Shuttle service was superb. This resulted from the extremely high prices in the dinning facilities within the hotel. That would be the lone drawback to staying here. Check-in and check-out were quick and easy. Again, the best thing about a stay here is the staff you interact with they are the best!",0
95898565,4,"Very comfortable rooms and friendly staff, plus great concierge lounge.",0
95898566,4,"The hotel is great, very nice rooms and a great view. The beach area is quiet, you can walk on the park thats across the street. If you are there for a meeting, event or convention, its even better since hte hotel, as the name says, has its own convention center and you dont even have to go outside! ",0
95898567,4,"Everything was easy to get to, the food was great. The room was large and comfortable and wonderfully maintained. This is the second time around for our group, which means 400 other people enjoyed it too - or we don't comeback!I am so glad you came back and enjoyed the experience again!",0
95898568,5,This is an older hotel but far from beyond it's prime! They have done a fine job of keeping it updated. I love the way the rooms all open up to the main open area.,0
95898569,4, The line for breakfast was quite long all four days I was there- get there early or be prepared to wait.,0
95898570,4,This was a great hotel pick if you want to be away from the craziness of any city you are at. The beach is the best here along with the poolside service.,0
95898571,4,The facility is beautiful and so close to restaurants.(Has one in the atrium) It's a little on the pricey side but its very secure.,0
95898572,5,"This was a nice well run hotel, a little nicer and better run that most in it's class, but the staff were are more sincerely helpful and friendly than any hotel I have ever stayed in.",0
95898573,4,"Everyone there is pleasant, professional and sincere. ",0
95898574,4,"This hotel is nice. The staff is great and we chose to use valet parking. There is parking available on each side of the hotel, however, we opt for valet. This is a very busy hotel with several events (weddings etc...) going on. The rooms are spacious as well as the bath. The bed was too soft for my liking.",0
95898575,3,Never have I spent so much on a hotel that seemed so unsure of itself.,0
95898576,4,"The hotel is convenient to the convention center, connected, and a number of great eating places within minutes of the hotel. The the only drawback was the shuttle service, on every occassion but one it took over 15 minutes for the captain to find a driver, in 2 instances I had to show the driver how to get to the restaurant.",0
95898577,5, Room was large and quite spacious with wrap around windows that offered a nice view. King sized bed and desk and complimentary Internet. Clean and looked to be recently renovated. ,0
95898578,5,"I booked this hotel for a weekend birthday trip. Upon arrival, my friend and I were greeted at the door. The front desk staff were very nice and personable. I was able to have an early check in as well. ",0
95898579,5,Overall a very good stay!,0
95898580,4,I've stayed at this hotel for 10+ years and it is continuing to get better. ,0
95898581,5,"I didn't have the opportunity to dine in the hotel so I can't comment on restaurants or food. Front desk staff was very friendly.The only negative, which I didn't notice but others in my group did, was the noise coming from the open restaurant areas in the lobby.",0
95898582,3,The subfloor of the shower was not good the water pressure was less than satisfactory. I most likely would not stay here again mostly because of the lack of hospitality.,0
95898583,4,Hotel was clean and hotel staff very helpful.,0
95898584,5, the amenities and location along with upgrades makes this an awesome place to stay! Shopping is also inside the hotel with several cheaper places to eat in the connecting building. The staff was excellent and the convention rooms were of good quality.,0
95898585,5,We experienced very good customer service in all key areas. The onsite parking was extensive and easy to deal with.,0
95898586,5,"I have traveled for business a lot, and I've come to expect little from convention hotels. So I was delightfully surprised. All in all, the staff was courteous, the rooms were clean and comfortable, and the experience was overwhelmingly positive.",0
95898587,4,Walking into this place I was greeted with such respect and helpful people.,0
95898588,5,"really nice hotel, lots of stuff around hotel.",0
95898589,3,Good place with great people.,0
95898590,4,Not too shabby at all! Lovely resort!,0
95898591,4,The food was amazing here with the ever rotating menu providing really interesting food specials.,0
