review_id,rating,comment,is_negative
95898001,5,Such a great experience! Everything was wonderful!,0
95898002,5,The beach was amazing. The hotel was beautiful and everything was great!,0
95898003,5,My family and I will visit again! The staff made my children felt so special!,0
95898004,5,Hands down the best place to be in the summer. ,0
95898005,1,What a tragedy. The spa staff were so unprofessional and so overpriced. I tried to stay peaceful but they were outright awful.,1
95898006,4,"Everything was good. Except for check-in which was slow, everything was great.",0
95898007,5,This is the best! The steak in the main restaurant was amazing! Please keep this on the menu.,0
95898008,5,Loved it! The spa was so great!,0
95898009,4,The view was great. But the room had to be recleaned when we got in. Great time though.,0
95898010,1,Our room was a mess. It took 40 minutes just to get housekeeping to come in to then do a shoddy job.,1
95898011,5,What a lovely place! The staff were so amazing and efficient in taking care of our every need.,0
95898012,5,The ocean front room is amazing. Hearing the crash of waves in the morning is so peaceful.,0
95898013,4,"The main restaurant, Jasmine Pearl was fabulous. I just wish it wasn't so pricey.",0
95898014,4,"The room was a little bit messy when we came in but other than that, the stay was lovely.",0
95898015,5,A grand spot to take the family!,0
95898016,4,Definitely an above average place to stay. Just a bit confusing to get around,0
95898017,4,It's a very peaceful and quaint place. The hotel was cool.,0
95898018,5,So good! Will be coming back!,0
95898019,5,It's my first time here and it was great. What a great place,0
95898020,4,Pretty good resort overall. One thing I didn't like was the spa. The spa was weirdly cold.,0
95898021,1,I paid for an ocean view room and I can only see a sliver of the water? What a scam!,1
95898022,1,The food at the restaurant was horrid! I can't believe I had to pay sixty dollars on a dry aged slab of garbage!,1
95898023,5,"The pool, the beach, everything was fun!",0
95898024,4,It's an overall good resort. ,0
95898025,5,The best part is staff. They really show that great hospitality.,0
95898026,3,"For a resort, I expected a bit more. The room was nice, the service was just okay, and the food I had was really subpar.",0
95898027,5,Really amazing place to be. The beach is beautiful and the staff were so helpful.,0
95898028,5,"Overall, it's an A Plus from me. The goart cheese fritters in the bar were divine.",0
95898029,5,The people here are so nice and hospitable.,0
95898030,1,My room was not cleaned when I entered it. It smelled rancid.,1
95898031,4,Great place for conferences. Staff are nice and do their best.,0
95898032,5,The concierge set my family up so well with everything. This resort is a great experience.,0
95898033,5,Thank you for everything!,0
95898034,4,Quality resort and beautiful amenities. Above average food.,0
95898035,5,So fancy! The beach was so pretty!,0
95898036,1,This was the worst experience in a resort I've ever been to. The spa was lackluster and the water was harsh on my body. I just wanted to relax but now I have skinflakes from this establishment.,1
95898037,5,"The Presidential Suite was amazing. It housed my party greatly and with such fast staff, it was an amazing experience",0
95898038,1,Down right awful. I can't believe that the room was not cleaned before our arrival.,1
95898039,1,The banquet we were supposed to have was ruined by poor service. Absolutely terrible.,1
95898040,1,The front desk was so rude. We wanted to dispute our bill but they gave us so much attitude.,1
95898041,5,Fun experience. The resort staff gave us many great suggestions of what to do at the resort.,0
95898042,1,Horrible. This place is not clean. I kept scratching in my bed when I tried to sleep.,1
95898043,5,Such a lovely place. The upkeep of this resort is impeccable. Absolutely stunning.,0
95898044,4,Great place overall. Transportation to the resort is hit or miss.,0
95898045,5,Wow is all I can say. What an amazing experience.,0
95898046,1,"Our dinner was really bad. My porterhouse was overcooked, my wife's food wasn't seasoned and the cocktails we ordered were overly sweet.",1
95898047,5,This is the best place to be. On a beautiful beach sipping sangria. ,0
95898048,4,This hotel is definitely really good. Only downside is the price.,0
95898049,4,"Really great, but not the best value.",0
95898050,5,Very extravagant. Our suite was impeccable and the ocean view was breathtaking.,0
95898051,5,I can't believe I stayed here! All the staff were so efficient and helpful. Such an amazing time.,0
95898052,4,Staff was great and really work hard. The room was a little untidy.,0
95898053,5,The charcuterie they offered in the bar was amazing. I was there every night.,0
95898054,5,I want to live here. The porterhouse here is to die for.,0
95898055,5,So much family fun along with amazing staff to help you every step of the way.,0
95898056,4,Everything was good. My family had a good time.,0
95898057,5,Absolutely mind-blowing. I have never been at a resort that was so hospitable.,0
95898058,5,Extremely accommodating. They do not cut corners and have an incredible sense of how to satisfy the guests.,0
95898059,5,Such a beautiful place. I will return with more friends next time.,0
95898060,4,"Value wise, it is not the best. Regardless, it was still a fun time",0
95898061,1,"It was so noisy. I know it's not the hotel's fault for the noise, but they declined to address my concerns and were not at all accommodating.",1
95898062,3,This resort was just adequate. Nothing too special. ,0
95898063,1,What a waste. Our sheets were not pressed and the view was not what we asked for.,1
95898064,1,Awful. It rained during our stay and the hotel had nothing to offer us to do. Our family was devestated.,1
95898065,2,This review is two stars solely because the staff was great. Everything else was down the drain. Especially the spa which was despicable.,1
95898066,1,That is no spa. To charge such high prices for low-quality treatment is outrageous. Never again.,1
95898067,5,My anniversary here with my husband was the best. Thank you!,0
95898068,5,I will return here! The beach is really something else here!,0
95898069,1,This place is distasteful. Especially the spa. I can't believe how much you charge for a simple thirty minute massage.,1
95898070,5,So serene and peaceful! The poolside food service really made my day!,0
95898071,5,Great menu options for both food and drink! Will never get over how amazing this place is.,0
95898072,5,The resort is marvelous. The governor's suite provided such a great place for my family.,0
95898073,4,The views are amazing. I just wish we had a little bit more of a view of the ocean.,0
95898074,5,So beautiful! I can't wait to come back!,0
95898075,5,I love this place. I can't wait to come back to see what foods they will have the next time!,0
95898076,4,Our conference was a success and it was really pleasant.,0
95898077,4,Really standard experience. The food and drink was the best part. My favorite was the seasonal fish.,0
95898078,3,The food was outstanding. The best steak I 've had in a long time. The spa though was atrocious. This place needs to step up their spa game.,0
95898079,5,Everyone was so helpful! I can't thank the staff enough for taking care my every request.,0
95898080,5,Pleasant and beautiful place overall. All of the staff had smiles on their faces and always made my day.,0
95898081,4,Good service and food. Our room was not resrocked when we first arrived.,0
95898082,3,The room was just okay. It seemed a little run down and our AC would give out. Everything else was impeccable.,0
95898083,1,What a beautiful hellscape. It's so pretty coupled with terrible service and disgusting food.,1
95898084,1,Overpriced and filthy. Your check in is so slow and the rooms we were put in were all riddled with crumbs and dust.,1
95898085,1,My TV was broken and the maintenance team was inconsiderate.,1
95898086,5,The staff are the highlight of this place. So accommodating and helpful.,0
95898087,1,I will not be coming back. I have mobility handicaps and I was rushed out of my room for check out. Everything was great until that point.,1
95898088,4,Really pleasant and fun. Just a bit pricey,0
95898089,1,This place has me so upset. Housekeeping did a horrible clean of my room and went into my room with my do not disturb sign on the door.,1
95898090,5,Exceeded my expectations. The ribeye and old fashioned is so delicious.,0
95898091,4,This is a fun resort with good amenities. I enjoyed my stay.,0
95898092,1,The spa was so bad. I can't believe how unprofessional and unkept the spa is.,1
95898093,1,The conference rooms were not set up for my meetings in time and I was given excuse after excuse by the event manager. This has been so unprofessional.,1
95898094,5,The ocean front suite is so beautiful and ,0
95898095,4,Really pretty views and caring staff. The meals I had were somewhat salty.,0
95898096,4,What a pretty resort. The staff is helpful in every aspect.,0
95898097,5,The boutique stores are so cute! I love the gifts that you have to sell!,0
95898098,4,Pricey but worth it!,0
95898099,1,I sent my food back three times because each time it was overcooked. Also my server was outright mean to me.,1
95898100,1,"The spa staff were so uncaring. I understand if it's busy, but they simply did not want to help with my simplest requests.",1
95898101,5,The chicken taco special was amazing! Poolside is the way to go!,0
95898102,5,"The concierge was amazing! They are informative and professional, setting up acommodations for us outside of the hotel as well.",0
95898103,5,"Simply outstanding. The views, the food, and the overall vibe cannot be beaten.",0
95898104,5,My mind has been blown. The staff took care of us at every step.,0
95898105,4,The Jensen Suite was nice but smaller than expected. Regardless it was amazing.,0
95898106,5,The ocean front room is crazy. It is definitely the highlight of my trip.,0
95898107,5,"The staff is so fast and efficient! Even when busy, they know how to be efficient with all of the guests.",0
95898108,5,The spicy margaritas and other cocktails are really delicious.,0
95898109,5,What an amazing experience. I will never forget these past few days.,0
95898110,1,I am absolutely infuriated. I paid for a spa package for them to tell me I can't use it because it was overbooked. Unprofessional.,1
95898111,4,The breakfast buffet was amazing even though a bit pricey.,0
95898112,5,"If I could, I would stay here indefinitely. It is very beautiful with really good food, drinks, and amenities.",0
95898113,5,The beach is so relaxing. To be able to order drinks poolside is even better.,0
95898114,4,Everything was good. The room view was a little underwhelming though.,0
95898115,1,My room was filthy upon arrival and it took 30 minutes for someone just to come and barely clean it.,1
95898116,5,Such an extravagent experience. I will be returning,0
95898117,5,My kids and I were so happy to be here. This was amazing!,0
95898118,4,The conference overall was a success. There were a few hiccups but the staff accommodated.,0
95898119,4,"The spa was a little underwhelming, but overall it was a great time.",0
95898120,5,My experience here was simply the best. The mushroom risotto was absolutely the best dish I had here.,0
95898121,4,It was a pleasant experience.,0
95898122,4,Pretty good for what we paid for. I wish there was more to do.,0
95898123,5,Everything was perfect. I loved every aspect of this resort.,0
95898124,5,Very family friendly!,0
95898125,4,It was a fun experience to be here with the family. The beach was nice and everyone was very sweet to us.,0
95898126,1,Our experience was not at all what we hoped. The food was awful and our room was a mess. I can't believe how much we spent and how little value we received.,1
95898127,1,"This was atrocious. I don't like to complain, but this was really one of the worst experiences I've had. No one came to our aid when we needed it, everything felt dirty, and none of the amenities were even at par.",1
95898128,5,Really great! I have no complaints and I will we back with my friends and family.,0
95898129,4,Wonderful place. A little bit outdated but still a good beach place to relax.,0
95898130,5,Never thought I'd experience anything like this. Truly outstanding!,0
95898131,3,The experience here is just above average. Everything is what you expect it to be here. Nothing mind-blowing,0
95898132,5,Such a beautiful place. We can't wait to come back!,0
95898133,5,This the best resort I've ever been to. So beautiful and the people here areso helpful and hospitable!,0
95898134,5,Lovely job all around. I love this place and I never want to leave!,0
95898135,1,"It's really bad. I was told that there were so many great things about this resort and nothing has been even remotely positive. The food is bad, the spa amenities are broken, and it's just not a good time. this place needs to be better.",1
95898136,4,"Pretty good I will say. The food, especially breakfast here, is pretty special.",0
95898137,5,I can't believe how great this place is. It's so beautiful and the staff are the best!,0
95898138,5,Spectacular resort! Everything was perfect with everything being perfectly executed.,0
95898139,4,Great experience for great value. Much love goes out to this resort.,0
95898140,5,Our wedding party enjoyed every aspect of this resort. The catering expecially was amazing along with the bar cocktails that were prepared for us.,0
95898141,1,Never again will we come here. Repeatedly have we asked to get our room cleaned for the staff to only steam our sheets and nothing else. There is no care here for the guests.,1
95898142,5,Such a beautiful place! The concierge was especially helpful as they provided everything we needed in a timely manner.,0
95898143,1,The front desk was awful. I don’t understand why you would hire such terrible front desk staff that do not care about guest experience..,1
95898144,1,I feel sick after being here. The outdoor food stand made me feel sick along with the dirty rooms. It's like the vents aren't clean.,1
95898145,1,The spa is the reason why you are getting a poor rating. Fix your amenities and train your staff better.,1
95898146,5,Lovely resort. I will always be happy coming here! The staff as always take care of my family and I.,0
95898147,1,"Dirty. For paying over 700 dollars a night, it at minimum needs to be clean.",1
95898148,5,Really beautiful views and accommodating staff. Good job!,0
95898149,4,Our business meeting went according to plan and the service provided was more than adequate. Thank you!,0
95898150,5,We are so appreciative of everything the staff does here. They are truly the stars of the resort.,0
95898151,1,What a distasteful experience! Everything is so overpriced with the lackluster service!,1
95898152,5,Your services here are unparalleled! The beach is the best part about this resort.,0
95898153,4,It's a really fun resort. Definitely a place to be in the summer. Really great amenities and beautiful views.,0
95898154,4,The food here was surprisingly good! The pool staff came in handy with great cocktails and food.,0
95898155,5,"Everything considered, this resort produces quality value with the food, scenery and the amenities.",0
95898156,5,So many great things for the family to do! Thank you for the great experience!,0
95898157,4,Much love goes out to the staff who do their best with what they have. Not the best experience but still a positive one!,0
95898158,5,Amazing. The Pearl had the best seafood I've ever had,0
95898159,5,The new revamp of the Pearl was amazing! Lovely new food options!,0
95898160,5,The staff and service is unbeatable here!,0
95898161,4,Rooms were unclean when we came in but the housekeeping made it brand new. The front desk apologized and made it up by providing free amenities. They really do go above and beyond.,0
95898162,5,The pool was really nice to have the kids be out there and play. Definitely a highlight.,0
95898163,5,The hotel amenities that were beachside cannot be beaten here.,0
95898164,5,I want to be here all the time. It is so beautiful and the staff here really are caring.,0
95898165,4,Really great. The meeting we had was taken care of nicely with the food and drink provided.,0
95898166,1,This was an upsetting find of a resort. Our rooms were not cleaned properly. We relocated three times to new rooms and each and every time our rooms were filthy.,1
95898167,3,"It was a nice stay overall. The spa however, was definitely not the best, but it was made up by the fact that it was beautiful and things were taken care of quickly.",0
95898168,1,"You all need to do better. If I can't enjoy my dinner in peace, then there is no way I am returning. Things need to be handled here. It should not be expected for the guest to take care of their own problems.",1
95898169,1,Gross and awful. The spa made me so angry and there was nothing to accommodate my dietary restrictions.,1
95898170,2,This resort was a letdown. The spa was not good and the in room dining service was just okay. It is a very beautiful place but that's all it is. It’s just a ,1
95898171,1,"My bags were lost, the front desk were incredibly rude, and the bar food and drink that you tried to make it up with was just downright terrible. Never again will I stay here.",1
95898172,5,I will be back. This is amazing with all of the innovative food items at the pool and the lovely amenities.,0
95898173,5,This resort is such a great time! I can't believe how beautiful it is and amazing the staff are.,0
95898174,1,The spa is absolutely awful. I can't believe you charge over 90 dollars for mediocre massages.,1
95898175,5,Wow! This is all I can say because everything is so perfect! I love the aesthetic!,0
95898176,5,I cannot begin to describe the amazing time we had. Absolutely breathtaking.,0
95898177,5,The food was impeccable. The seafood specials that were provided were absolutely phenomenal.,0
95898178,4,This a lovely spot to host any type of event. The event staff really do a great job and the amenitites to provide to event guests are nice as well.,0
95898179,5,The concierge team provided so much and made it such a personal and lovely stay for my family and I. I can't thank them enough.,0
95898180,5,Thank you for the great time!,0
95898181,4,Lovely place. The breakfast buffest is definitely the place to be to pick yourself back up.,0
95898182,4,Pretty good resort overall! I was pleasntly surprised about the service and their efficiency!,0
95898183,3,Standard resort with good amentities. It's pretty confusing to navigate though.,0
95898184,5,It's such a good place to be with friends and family. They even have beach amenities for guests!,0
95898185,5,It can't get better. The poolside bar is definitely my go to when I come back.,0
95898186,4,The staff was wonderful here. ,0
95898187,3,"It was a good stay. Unfortunately, my room was messy when we came in and the in room dining was not good",0
95898188,1,Awful! Don't provide in-room dining anymore. Everything was disgusting.!,1
95898189,1,"To be frank, this was an awful stay hosted by an incompent front desk team. You can't tell me what I experienced here when I was the one who experienced it. You are downright in the wrong and need to be fired.",1
95898190,1,It's not good. I had high hopes and I was wrong. Your team needs to do better in providing better service.,1
95898191,5,I can't wait to come back here and take my family to your beach! It's so much fun!,0
95898192,1,How do I get bumped off of my spa treatment? What kind of place are you running here?,1
95898193,4,This is such a fun resort. There are things I would change but overall it was pleasant!,0
95898194,1,"I really don't like to complain, but when there are bugs and hair in our supposedly clean room, something needs to be said. ",1
95898195,5,I can't thank you all enough for how wonderful you made my birthday party here!,0
95898196,4,What a great place to be in the summer. The amenities around the hotel itself are very fun.,0
95898197,1,Grossly overrated hotel. The service alone is not deserving of anything higher than a 1 star rating.,1
95898198,1,Your staff is so pretentious. I simply ask a question about the menu and they scoff at me as if I did something wrong. Train your people to be better. This was the worst experience I have ever had in my life.,1
95898199,5,Simply world class! You guys do everything right here!,0
95898200,4,Really great resort with lovely food options. The drinks made at the bar are especially delicious.,0
95898201,4,Really cool place. Very beauttiful!,0
95898202,5,Thank you!,0
95898203,4,Really great experience to be here!,0
95898204,1,Never again will my family and I come here. This place was overpriced and unclean. The services here are such a disappointment.,1
95898205,1,Why can't housekeeping do their job? It's not hard to clean a room!,1
95898206,5,I've never had food quite like this at a resort. This was definitely something special.,0
95898207,5,I love this resort! The staff are the best here as they provided everything that my party and I needed for our wedding.,0
95898208,5,Simply amazing and beautiful. The poolside margaritas were amazing.,0
95898209,5,Thank you for such an amazing stay!,0
95898210,4,Pretty good resort that provides everything you need.,0
95898211,5,We are so thankful for our stay! This was actually the best time my family and I had.,0
95898212,4,"Overall, this was a great stay and the food was fantastic. The tilapia was amazing!",0
95898213,5,This was amazing! The ambiance and food was superb!,0
95898214,1,Unbelievable! This was awful. I will never be here again with how poor everything was here.,1
95898215,1,"How do you make guests pay for this type of experience? Our spa appointment was moved without notice, and once we got there, it was awful!",1
95898216,1,The spa needs to be taken care of. The water is so hard and the spa workers were unaccommodating to make any changes for us. What a waste.,1
95898217,1,"I am trying to like this place. However, when you food is consistently inedible and your rooms are gross, I can't do it. After five years of being here, I won't ereturn.",1
95898218,4,"It's always a pleasure to say here! I didn't like this year's food specials, but it still gives the best memories.",0
95898219,5,So much fun. I can't begin to describe my experience.,0
95898220,4,I love this place. It was a bit chaotic but overall a great time,0
95898221,1,Never again. Your food is so overcooked at the pool and the drinks are unappetizing.,1
95898222,4,The staff really are incredible. You all are amazing.,0
95898223,5,I loved everything about our stay! Thank you!,0
95898224,5,Hotel with Personality!,0
95898225,5,What a great experience!,0
95898226,5,Great hotel!,0
95898227,5,"Friendly, helpful staff and comfortable rooms!",0
95898228,5,So amazing! I loved every bit of our stay! Thank you for the great experience!,0
95898229,4,Valuable experience to remember!,0
95898230,2,Never again!,1
95898231,5,Excellent,0
95898232,4,The staff at the place is extremely friendly.,0
95898233,2,I don't understand the mindset as to the reason why this place can't be clean!,1
95898234,4,EVERYTHING WORK OUT JUST FINE,0
95898235,4,Great stay. ,0
95898236,5,Honestly such a great time!,0
95898237,5,I absolutely loved it and will definitely be back in the near future!,0
95898238,3,NIGHT MARE!!!,1
95898239,2,The staff here are so rude and the owner is cheap with what they provide here.,1
95898240,3,Need the minimum for an inexpensive price - this is the deal for you!,1
95898241,5,We'll be back.,0
95898242,4,We'll be back again,0
95898243,5,Definitely coming back!,0
95898244,2,There are definitely bed bugs here,1
95898245,5,It's my favorite place go I've booked for November for my birthday this year.,0
95898246,5,"Room seemed to be brand new, very clean, and was perfect. was completely 100 and more satisfied. The staff there was so friendly.",0
95898247,5,We'll be back.,0
95898248,1,Your staff is so pretentious. I simply ask a question about the menu and they scoff at me as if I did something wrong. Train your people to be better. This was the worst experience I have ever had in my life.,1
95898249,5,Simply world class! You guys do everything right here!,0
95898250,4,Really great resort with lovely food options. The drinks made at the bar are especially delicious.,0
95898251,4,Really cool place. Very beauttiful!,0
95898252,5,Thank you!,0
95898253,4,Really great experience to be here!,0
95898254,1,Never again will my family and I come here. This place was overpriced and unclean. The services here are such a disappointment.,1
95898255,1,Why can't housekeeping do their job? It's not hard to clean a room!,1
95898256,5,I've never had food quite like this at a resort. This was definitely something special.,0
95898257,5,I love this resort! The staff are the best here as they provided everything that my party and I needed for our wedding.,0
95898258,5,Simply amazing and beautiful. The poolside margaritas were amazing.,0
95898259,5,Thank you for such an amazing stay!,0
95898260,1,Very unclean. The rooms smelled of mold and everything in the room felt stale. The air was pungent during our stay.,1
95898261,1,"I know this isn't the hotel's fault for it being noisy in another patron's room, but to not try to helpus find a resolution is absolutely unacceptable. Our stay was absolute hell.",1
95898262,4,Really fun place to be! The beach was amazing!,0
95898263,2,The hotel was unclean when we stayed. Do you not have proper housekeeping?,1
