review_id,rating,comment,is_negative
95898264,4,"Very clean hotel, good breakfast, good value for your money. The only reason for not giving it 5 stars... the single bed rooms are small. I did not get a chance to use the pool, but pool room looked extremely clean as well.",0
95898265,4,The front desk clerk was strangely short with me. But everything else was nice.,0
95898266,4,The staff is really nice and they go out of there way too help. Breakfast was amazing during our stay!,0
95898267,5,Lovely all around! The seafood was amazing and the pool was great!,0
95898268,1,This was a horrible stay. The hotel was run down and dirty. We were not able to get to our reserved king room because supposedly the battery in the door was going bad and couldn't get in after going back to the office.,1
95898269,2,Our room was sub-standard. Two of the four lights didn't work. The bath tub and sink needed to be cleaned. They both drained VERY slowly. While showering you had to stand in water up to your ankles. The fitted sheet was on the bed inside out... certainly hope that they didn't turn it over.,1
95898270,2,Not quite what we hoped at all. I wish everything was taken care of a little bit better.,1
95898271,5,The food was amazing here! The steak house was really interesting and had great options for everyone in our party.,0
95898272,4,It's really a cute hotel with beauty and standards. So nice!,0
95898273,1,Why are the rooms so unclean? Our room was so filthy with the sheets not steamed and pressed!,1
95898274,4,Everything was pretty good! No compplaints at all.,0
95898275,3,It was a pretty standard resort experience. The best thing here is the beaach.,0
95898276,3,Nothing too mind-blowing. The rooms do the job and the food was pretty good at least.,0
95898277,1,I can't believe how awful this was. It was really awful all and all.,1
95898278,5,Excellent hotel so beautiful,0
95898279,4,"Loved the room, it was cute, cozy, and comfortable!",0
95898280,5,Very good resort with lovely amenities! You guys do great,0
95898281,3,Please fix your spa. Other than that it was a great time here.,0
95898282,5,Fun and exciting beach vibes. Will be coming back again with family!,0
95898283,2,Our toilet was not functioning for the majority of our stay. We tried to move but there was nothing available. They offered us vouchers for another stay but what's the point if the stay is already horrible in the first place?,1
95898284,5,You guys are so amazing. Your staff is phenomenal as they service everything we need when we need it. Thank you!,0
95898285,5,We are so appreciative of your help! You guys did wonderful.,0
95898286,1,So disappointing! I can't get help for my life! Just to get an answer about the simplest things regarding the hotel is so arduous here!,1
95898287,4,Really fun place and the views are so surreal!,0
95898288,5,Lovely amenities along with great staff. This was amazing.,0
95898289,5,I will never go anywhere else again for vacation. Thank you all for a beautiful experience.,0
95898290,1,I should not be charged for this experience! My family and I had such a poor time here it's ridiculous,1
95898291,2,Nice staff but they seemed uninformed about events happening around the resort.,1
95898292,4,Nice for the price,0
95898293,3,The rooms were beautiful and overall it was nice but the spa was disgusting.,0
95898294,5,Great stay that exceeded expectations!,0
95898295,5,Thank you!,0
95898296,5,This was a great present for my son. This absolutely was the best graduation present and great getaway for my son and my family.,0
95898297,5,Amazing. Everything was mindblowing,0
95898298,4,Will absolutely visit again.,0
95898299,2,Mediocore resort experience. I felt very much let down,1
95898300,4,"very comfortable, greatful for the wakeup call to catch the plane!",0
95898301,5,We were greeted with joy and happiness--felt good,0
95898302,4,The beach was serene and the pool side amentities are so nice.,0
95898303,4,The best aspect of this resort are its amentities. There is a lot to do for the family here at the hotel.,0
95898304,4,"What a great vacation spot. Even for business meetings, it was really fun!",0
95898305,4,My wedding went off without a hitch here at the hotel. Thank you for this experience!,0
95898306,5,Quick and fun beach getaway,0
95898307,4,Wonderful stay!,0
95898308,5,A really cool secluded beach stay. Truly amazing to be here.,0
95898309,5,Two thumbs up for your staff. They were outstanding.,0
95898310,3,I feel cheated for how much we had to pay. It still was a great experience though,0
95898311,1,Don't be fooled. It’s definitely pretty but that's all it is. The service and food is terrible with nothing to do.,1
95898312,5,It was an unforgettable time! Thank you all again!,0
95898313,3,"Good hotel, but not so crazy about the area as it is so far away from the city.",0
95898314,5,This hotel has everything. Beautiful grounds and interior. We stayed here for 3 nights but wish we had booked longer as we didn't have time to make use of the amazing pool area.,0
95898315,5,This is an excellent property. It really fits the resort catagory. ,0
95898316,5,Great hotel and activities. They think of everything. Customer service is absolutly great. We will difinitly be back in our future trip. Thank you!,0
95898317,5,Such a great resort! The food and service is amazing.,0
95898318,5,I cannot say enough about our family vacation. The place is amazing. The best though is the incredible club lounge for club level guests. The food was sooo good! They accommodated gluten free every meal or snack.  ,0
95898319,5,Great resort all in all! The beach is secluded and has lovely amenities!,0
95898320,5,Everything about our stay from the moment we checked in was a very positive experience. Our room was beautiful. The pool area was also nice and clean with plenty of towels and loungers available. Definitely the perfect stay!,0
95898321,4," The customer service was variable and I was disappointed with their lack of assistance when we encountered an issue with our air conditioner, but still great overall.",0
95898322,3,"Room rate was high, only had a King size bed, check in was very long, tour bus was parked and running for a long time, room was quiet and large. bathroom did not have a working tub.",0
95898323,4,"Hotel was just ok nothing special. Was down here for a party weekend so worth it. The town is amazing, because theres so much fun stuff to do there. Great many bars and restaurants.",0
95898324,5,"I stayed here with a couple friends. Very friendly hotel!  The location is far from all the action, but a quick cab ride away... worth the stay. ",0
95898325,4,"The folks here have paid attention to detail and made this a wonderful place to stay. There is Plenty of room for parking, a nice breakfast, comfortable rooms, easy check in and out. ",0
95898326,5," They had a contential breakfast at the hotel and that was nice. It had a great selection with staff that worked really hard the entire time to keep everything stocked, cleaned, and looking nice. It was just a nice hotel all around and we couldn't beat the price. Very happy with our stay here.",0
95898327,5,We had an amazing time!,0
95898328,5,The food was so good and the ambiance was lovely. Will be back soon.,0
95898329,5,What a great place to be at during any time of year. There are a bunch of differentt things to do on the island and the cincierge helps with anything you may need.,0
95898330,2,"After my business meeting, I came to a room that was not cleaned. Is there no housekeeping here?",1
95898331,1,The spa package is a total ripoff!,1
95898332,1,The spa is so awful. The water is hard and nothing there is comfortable at all.,1
95898333,4,"This hotel has everything you need and was tastefully done, but you'd never want to stay in it more then a night or two. ",0
95898334,5,"My husband made these reservations and I was a bit nervous after reading some reviews. However, our room was spotlessly clean, overlooked the lovely pool area and was quite nice. ",0
95898335,5,This property was delightful in every way -- the perfect place to celebrate my birthday!,0
95898336,1,"What a bad mistake choosing this hotel.  I thought that I could expect a certain minimum standard in service and accommodation because we frequent often, but this last experience has been the worst. Overcooked food, and horrible service overall.",1
95898337,4, I would return here for the accommodations and pool area! It's definitely one of the prettier places that I have been to.,0
95898338,3,"this a definitely memorable experience with my family but overall, it wasn't anything too extravagant.",0
95898339,2,We are repeat guests but sadly this will be our last stay as we will be looking to take our family elsewhere. This was our first vacation that we could not wait to get back home.,1
95898340,4,"Stayed for a total of eight days. Rooms spacious and updated recently. Everything in working order. A/C a bit noisy, but working fine. Overall, Hotel is showing its age here and there, but it is good value for the price. ",0
95898341,2,Very strong smell in the hallways I was in the last room on the second floor and the internet did not work They offer storage of luggage service but not allowed to leave the luggage after checkout. Extremely rude clerk who answered me in the checkout,1
95898342,1,Our toilet and bathtubs were creaking allowing us not to sleep. Please do better in maintaining the rooms. This was the worst room ever.,1
95898343,1,I don't even know how this place is still operating. The girls at the checkout desk are rude and confrontational. Their faces depict people that are being forced to work... Not helpful whatsoever. ,1
95898344,5,The most family friendly resort I have been to. Such hospitality!,0
95898345,5,. The service was fast and very friendly. All smiles. I enjoyed being at the pool!,0
95898346,4,I went here with friends from work and we had a good time. They have a small bar area but was good enough for the ten of us. Only drawback was the slow food service as it took over an hour for two small appetizers.,0
95898347,5,.The hotel is beautiful with a 5 story lobby and the room was really nice. The staff accommodated all of our requests to be in a quiet area.,0
95898348,5,I really like this hotel. The staff is friendly helpful. The rooms are clean and comfortable. It is quiet and allows for a great nights sleep especially after your conventions.,0
95898349,5,This was just what we needed to turn things around! We arrived early and they did not have rooms ready so they gave us drink vouchers and although we maybe waited 30 mins for a room they kept checking on us as well. Thank you!,0
95898350,4,No complaints. Really great resort with nice beach amentities.,0
95898351,5,Lovely beach resort with a beautiful view of the sunrise and sunset,0
95898352,5,The hotel staff was very knowledgeable and friendly. The beds were comfortable and sheets were clean. Check-in was a breeze.,0
95898353,4,Nice,0
95898354,4,I have stayed at this resort several times. The location is great and the staff is friendly. The hot water was only warm which made the stay less than stellar.,0
95898355,3,"This resort was nice overall, but our meeting could have been much better executed.",0
95898356,4,Our first stay at this location it was ok.. Very nice breakfast not much room to sit though. Found internet ok in lobby but not in the assigned room. Would stay again but need the internet in the room.,0
95898357,3, i tried to reach my fiance on the room phone so annoying but the hotel can use some new clean mattresses. Anyways the phone issue was my biggest problem.,0
95898358,2,the room we stayed in was unclean and felt cheap. Some of the wood was chipping off our headboard.,1
95898359,4,"This is by far my favorite resort I have been to. Nicely decorated, very clean, and it is nicely secluded from the busy city!",0
95898360,1,"I stayed in a room on the 3rd floor. Upon waking up, I found a bed bug on the curtain. After calling the front desk, I was told that finding a bed bug was absolutely impossible. Such a disgusting attitude and room alike.",1
95898361,2, Staff was friendly and easy check in. Everything else was disappointing and overpriced. Especially with how bad the spa is.,1
95898362,5,Checking was fast and the staff were friendly. This is a very nice hotel. The room was excellent with comfortable furniture and bed. ,0
95898363,2,"I checked in to the hotel greeted with a smile, which was good.. When I went in to the room, it was stuffy even with the AC on. Which was really, really loud. I could not sleep. And if I turn down the AC, it was too hot.  The bathroom was moldy. The breakfast was bad. The coffee was horrible. All in all, I had to check out after 1 night of my 5 night vacation.",1
95898364,5,"We were thoroughly satisfied with our stay at Holiday Inn Express.  For a budget hotel, the surroundings were clean, freshly painted, and we commented that the bedding was the most comfortable of any we'd slept in.  We would definitely recommend this hotel.",0
95898365,5,Weather was cold but we enjoyed the visit. Very beautiful trails especially during the evening,0
95898366,4,"Overall, I enjoy this hotel. I have stayed there a total of 5 times for business purposes. Each stay was for nearly a week. The staff are always warm and welcoming. My bathroom has been ""dirty"" a few times, such as hair in the sink or toilet. But nothing horrible enough to request another room. Overall, great stay.",0
95898367,4," The room was clean and neat, the staff friendly and helpful. I did find the hotel a bit too far from the downtown. When we rented a car we could park it for free at the hotel, which I am told is not always so. ",0
95898368,5,"Very comfortable, with great food and lovely amenities. The pool was amazing with their poolside food service.",0
95898369,5,Great staff and well taken care of facility!,0
95898370,4,The staff was amazing and definitely the highlight of my stay,0
95898371,4,Stay was overall wonderful. Bathrooms could use a little maintenance. We would stay here again.,0
95898372,5,"Stayed only one night as a walk in. Beautiful clean room, delicious breakfast, super friendly staff. ",0
95898373,2,Wifi was totally non existent! Staff was neither friendly nor unfriendly.,1
95898374,4,"The staff at this hotel went over and beyond in service and anything that was requested was done right away. The breakfast was great, warm, and refilled quickly. Fresh baked cookies in the evening waiting for us in the lobby. The pool was kept clean and service was efficient.",0
95898375,5,"Centrally located hotel on Hilton Head. This is a lovely, safe facility for the single female traveler. If only they offered small bottles of wine in their snack purchase area (other Hampton Inns have the license), I would say this was perfection :)",0
95898376,4,Helpful cheerful staff. Fun themes within the hotel that can be somewhat chaotic,0
95898377,5,Third time visiting this hotel!! Great stay will come again!! ,0
95898378,2,"Stayed here for three nights and all three nights was it loud. We called the front desk to handle it, to no avail. Please do better.",1
95898379,2,"Front desk reception staff very welcoming. Lobby comfortable and inviting . Room was dark and damp . Bathroom had mold in corners, needs a good scrubbing with bleach. ",1
95898380,4, The staff is friendly ,0
95898381,5,"The staff is very polite and accommodating, the resort concierge is knowledgable and booked us our amenities on and off the campus of the hotel",0
95898382,4,"The room is small and when we added a cot, it was almost too small. The important things, like air conditioner, tv package, internet, etc...were all sufficient. ",0
95898383,5, All Handicapped Accessible hotel rooms are NOT the same! 1. I could open the front door from my wheelchair. It was not too heavy to handle 2. ,0
95898384,1,Got to room got bags unloaded and then that is when we seen a roach. Seen one crawling on the floor and then my husband sat at desk to eat food and a baby one started crawling right in front of him on the desk. I would not stay here again.,1
95898385,5, The accommodations were what we would expect  but the staff went above and beyond our expectations. The room was very clean and comfortable. The in hotel restaurants were all lovely with great food accommodations and specials.,0
95898386,4,"The fold out couch linens were clean. The room furnishings could stand to be updated, but they served their purpose. We were surprised with the full kitchen in the room. ",0
95898387,5,"Our team has stayed here several times for business conventions in the area. Always have positive experiences here great service, good breakfast every morning. I highly recommend this hotel! Great at accommodating large groups.",0
95898388,4,My wedding was greatly accommodated here. I will never forget it. Thank you all!,0
95898389,1,"Disgusting room with sand everywhere. I get we are at a beach, but it looked like people were already in there.",1
95898390,4,"This place is very nice. However, for the room price, I felt it was a little bit underwhelming regarding accommodations.",0
95898391,4,The hotel is nice and we have a great room. Lobby is very inviting. The people at this hotel are very friendly What I have really notice is a lack of personnel. I think there are not enough employees for the size of the establishment.,0
95898392,1,"This was my first and it will be my last. I don't believe these review regarding how spectacular the front desk is, when in reality they don't really help. I ask for a simple late check out and they couldn't grant it, I'm here on business so that extra hour could of help me move a better way but thanx",1
95898393,5,"My bridesmaids booked this hotel for my post Bachelorette Party Shenanigans lodging. It was VERY comfortable, clean, and spacious. I felt so spoiled that they booked such a nice room for me. I wish I had pictures to post.",0
95898394,2,"The staff were delightful and most helpful, with special mention of the front desk! Check-in was a struggle for the staff - quite a few people arrived at the same time. Fortunately for us we were related or attending the same event and were not frustrated or anxious, but there was one person at the front desk. ",1
95898395,2,"This facility need to be renovated badly. Its has a lot of problems with the rooms, and management doesn't seem to do anything when told.",1
95898396,5, We were so impressed by this beautiful beach resort! Definitely our new summer spot. The food was definitely the highlight here.,0
95898397,5,Our total experience was excellent. The staff was very friendly.,0
95898398,2,"The spa was not good. The staff tried to accommodate me as much as they could, but it was not on point at all.",1
95898399,2," Control panel on AC didn't work, could only get cold or heat and that blew the flimsy curtains open. Nightlight wasn't working. Candy machine had melted candy. WiFi was extremely complicated to get on.",1
95898400,5,The poolside service was my favorite!,0
95898401,4,Comfortable stay with conventions running seamlessly.,0
95898402,4,"comfortable bed. microwave, fridge. sink area separate area from bathroom. Very beautiful luxury hotel",0
95898403,4,This facility was very good with one caveat - door to room was in need of maintenance attention - not urgent and the staff was notified at checkout. The checkin and checkout was easy and the staff friendly. ,0
95898404,4,"The junior suite was spacious but was lacking certain in room amenities. Staff however, was quick to replenish anything we needed.",0
95898405,1,"the front desk staff was rude during the morning shift, we asked to speak to the manager and he has not called us back, or toilet stop working, there was a spider in our bed, the big problem was not being contacted by the manager after serval attments.",1
95898406,4,The hotel was nice but unfortunately something was wrong with our air. We turned it in at checkin around 6 and was hoping by bedtime it would be better. We just decided to suck it up so we could try to get some rest in hopes of waking up cooler,0
95898407,1,Our reservation was bumped even though we paid in full. What an awful experience. Being kicked to the curb.,1
95898408,2,The rooms had 2 double beds instead of 2 queen beds and there were no available cribs or cots for our room. The TV in our room did not work. Other guests were quite loud into the night.,1
95898409,5,Great rooms at a very good prize. Very Nice atmosphere in this hotel. Grand lobby. Friendly staff. Short distance to dining. Enjoyed the stay in this hotel. They had a great pool. I would recomend this hotel.,0
95898410,5,"The staff was helpful in locating where we were attending a meeting. The hotel was wonderful from the coffee and rookies to the facility. the indoor pool was great. The room was great and clean. It was large, two closets and a very comfortable bed. The room was quiet and the hotel very nice. ",0
95898411,3,Staff very nice and helpful. Major disappointment was that hot tub was cold! Same temperature as pool beside it. We didn't really get what we paid for.,0
95898412,5,"I would stay with my family a few nights a week and was very pleasantly surprised by this resort. All of the amenities from the comfortably lobby, to the pool and hot tub, to the continental breakfas",0
95898413,4,"Everything was good, the room was clean and confortable, the people was kind and the facilities in good conditions. we are happy with our desitions, in addition good price.",0
95898414,5,Pleasant and accommodating. It was the perfect rest stop while on business.,0
95898415,1,"Other than the staff, this was the worst hotel experiences I and my traveling companions have ever had. ",1
95898416,3,In town overnight to attend a funeral. Nice hotel. Staff was very friendly.,0
95898417,5,"nice accommodations, friendly staff",0
95898418,5,Great hotel. Clean and comfortable with a very good breakfast.,0
95898419,5,loved it,0
95898420,5,Great looking and clean and friendly! Lovely onsite restaurants with great food!,0
95898421,4,It was great overall but can be overpriced depending on the amenities you purchase,0
95898422,5,Very nice and close to enerywhere I had to go,0
95898423,5,The room was very nice. I can't think of a way it could have been improved. The staff has pleasant and eager to please. I highly recommend this hotel.,0
95898424,5,We were visiting our daughter and found this hotel online. It was conveniently located for the activities that we planned for the weekend.,0
95898425,5,"The staff were wonderful, always willing to help.",0
95898426,3,No toilet paper in room upon arrival. Air did not work. Very hot in room.,0
95898427,5,Everything was just lovely. The managers were friendly and helpful. The room was large and had everything we needed. The pool was clean and nice and the beach access was great. I wish we could've stayed longer!,0
95898428,5,"We stayed here for our son's college graduation. Friendly, helpful, and accommodation staff comfy beds and pillows plenty of extra linens. Breakfast were plentiful, and a variety for all palettes, complimentary , snacks and drinks always available.",0
95898429,5,"Staff was compassionate, Room was very clean. Nice modern amenities. I will stay here every time I am in the area. easy check in and check out. Plenty of parking. Has a pool and nice fitness room but I did not use them",0
95898430,5,The hotel is very nice on the inside and outside. It's very up to date and the staff is amazing. ,0
95898431,5,I never write these kind of things but this time I thought it was warranted. My family and I just finished a stay and it was great. Very friendly staff.,0
95898432,1,Tragic stay here. I can'tbelieve anyone would pay for these overpriced rooms that were absolutely filthy.,1
95898433,1,This place makes me upset at the fact that it the spa was lackluster and the food was less than adequate. Never again will I visit your establishment.,1
95898434,2,"The staff were lovely but at the same time, the food was not good at the hotel restaurants. The food was dry and overcooked. Such a shame from a beautiful resort.",1
95898435,1,Why have a place that is so beautiful but just downright awful? Overpriced and underwhelming!,1
95898436,5,The overall ambience at this hotel was outstanding. What made our stay at this facility so pleasant was the staff. From the housekeeping staff to the desk staff the smiles and friendliness were always obvious. ,0
95898437,5,I checked in very late but the staff were very accommodating in making sure we were taken care of that evening.,0
95898438,5,"Stayed here 2 nights for a business/personal trip with my husband and our 2 kids. The staff was awesome during our entire stay helping out with restaurant suggestions, etc. Special props to Dave at the front desk who went above and beyond to be helpful during our stay. Room was very spacious and clean with comfortable beds. The complimentary breakfast... More",0
95898439,5, Larger room than normal with separate bathing from vanity. Comfortable beds with freshly cleaned spreads! Lovely breakfast buffet!,0
95898440,5,"Outstanding location, facility, staff, and accommodations. Fine foods and beverages served by personable staff in an ambience and environment that provide a soft-landing for travelers ready to relax.",0
95898441,5,"Very comfortable and relaxing.... But, most of all the quietness and friendliness of the employees.",0
95898442,5,Very friendly well staffed. Nice size rooms and beautiful views.,0
95898443,5,"Great place, location, and I appreciate the full bar in the lobby",0
95898444,5,it was great,0
